{
  "schema_version": "devseek.qualification-runner-inventory/v1",
  "integrity_scope": "local-protocol-conformance",
  "qualification_eligible": false,
  "composition_root": "scripts/lib/devseek-qualification-runner.mjs#createQualificationRunner",
  "entries": [
    {
      "entry_id": "golden-case/G0B-P01",
      "classification": "test-fixture",
      "role": "catalog-executor",
      "source_ref": "scripts/test/devseek-qualification-protocol.test.mjs",
      "entrypoint": "canonical-hash-vectors",
      "catalog_case_id": "G0B-P01",
      "qualification_enabled": false,
      "composition_root": null,
      "status": "catalog-metadata-conformance-only",
      "reason": "Catalog metadata points at an existing protocol conformance source; it is not a declared qualification runner."
    },
    {
      "entry_id": "golden-case/G0B-A01",
      "classification": "test-fixture",
      "role": "catalog-executor",
      "source_ref": "scripts/test/devseek-qualification-protocol.test.mjs",
      "entrypoint": "reject-unsigned-or-mutated-plan",
      "catalog_case_id": "G0B-A01",
      "qualification_enabled": false,
      "composition_root": null,
      "status": "catalog-metadata-conformance-only",
      "reason": "Catalog metadata points at an existing protocol conformance source; it is not a declared qualification runner."
    },
    {
      "entry_id": "golden-case/G0B-A02",
      "classification": "test-fixture",
      "role": "catalog-executor",
      "source_ref": "scripts/test/devseek-qualification-protocol.test.mjs",
      "entrypoint": "reject-runner-clock-drift",
      "catalog_case_id": "G0B-A02",
      "qualification_enabled": false,
      "composition_root": null,
      "status": "catalog-metadata-conformance-only",
      "reason": "Catalog metadata points at an existing protocol conformance source; it is not a declared qualification runner."
    },
    {
      "entry_id": "golden-case/G0B-A03",
      "classification": "test-fixture",
      "role": "catalog-executor",
      "source_ref": "scripts/test/devseek-qualification-protocol.test.mjs",
      "entrypoint": "reject-cross-session-receipt",
      "catalog_case_id": "G0B-A03",
      "qualification_enabled": false,
      "composition_root": null,
      "status": "catalog-metadata-conformance-only",
      "reason": "Catalog metadata points at an existing protocol conformance source; it is not a declared qualification runner."
    },
    {
      "entry_id": "golden-case/G0B-A04",
      "classification": "test-fixture",
      "role": "catalog-executor",
      "source_ref": "scripts/test/devseek-qualification-protocol.test.mjs",
      "entrypoint": "race-double-consumption",
      "catalog_case_id": "G0B-A04",
      "qualification_enabled": false,
      "composition_root": null,
      "status": "catalog-metadata-conformance-only",
      "reason": "Catalog metadata points at an existing protocol conformance source; it is not a declared qualification runner."
    },
    {
      "entry_id": "golden-case/G0B-A05",
      "classification": "test-fixture",
      "role": "catalog-executor",
      "source_ref": "scripts/test/devseek-qualification-protocol.test.mjs",
      "entrypoint": "reject-out-of-order-slot",
      "catalog_case_id": "G0B-A05",
      "qualification_enabled": false,
      "composition_root": null,
      "status": "catalog-metadata-conformance-only",
      "reason": "Catalog metadata points at an existing protocol conformance source; it is not a declared qualification runner."
    },
    {
      "entry_id": "golden-case/G0B-A06",
      "classification": "test-fixture",
      "role": "catalog-executor",
      "source_ref": "scripts/test/devseek-qualification-protocol.test.mjs",
      "entrypoint": "tamper-bound-fields",
      "catalog_case_id": "G0B-A06",
      "qualification_enabled": false,
      "composition_root": null,
      "status": "catalog-metadata-conformance-only",
      "reason": "Catalog metadata points at an existing protocol conformance source; it is not a declared qualification runner."
    },
    {
      "entry_id": "golden-case/G0B-A07",
      "classification": "test-fixture",
      "role": "catalog-executor",
      "source_ref": "scripts/test/devseek-qualification-protocol.test.mjs",
      "entrypoint": "reject-unadjudicated-retry",
      "catalog_case_id": "G0B-A07",
      "qualification_enabled": false,
      "composition_root": null,
      "status": "catalog-metadata-conformance-only",
      "reason": "Catalog metadata points at an existing protocol conformance source; it is not a declared qualification runner."
    },
    {
      "entry_id": "golden-case/G0B-A08",
      "classification": "test-fixture",
      "role": "catalog-executor",
      "source_ref": "scripts/test/devseek-qualification-protocol.test.mjs",
      "entrypoint": "break-event-chain",
      "catalog_case_id": "G0B-A08",
      "qualification_enabled": false,
      "composition_root": null,
      "status": "catalog-metadata-conformance-only",
      "reason": "Catalog metadata points at an existing protocol conformance source; it is not a declared qualification runner."
    },
    {
      "entry_id": "golden-case/G0B-A09",
      "classification": "test-fixture",
      "role": "catalog-executor",
      "source_ref": "scripts/test/devseek-qualification-protocol.test.mjs",
      "entrypoint": "reject-key-role-and-algorithm-confusion",
      "catalog_case_id": "G0B-A09",
      "qualification_enabled": false,
      "composition_root": null,
      "status": "catalog-metadata-conformance-only",
      "reason": "Catalog metadata points at an existing protocol conformance source; it is not a declared qualification runner."
    },
    {
      "entry_id": "local-simulation/guard-to-g0c",
      "classification": "test-fixture",
      "role": "qualification-runner",
      "source_ref": "scripts/lib/devseek-qualification-runner.mjs",
      "entrypoint": "createQualificationRunner",
      "qualification_enabled": true,
      "composition_root": "scripts/lib/devseek-qualification-runner.mjs#createQualificationRunner",
      "status": "wired-local-nonqualification",
      "reason": "Single executable local simulation proving plan/session/slot/guard/event/receipt/G0-C reachability; no catalog attack semantics or qualification claim is implied."
    },
    {
      "entry_id": "production/cli-exec",
      "classification": "production",
      "role": "product-surface",
      "source_ref": "packages/cli/src/index.ts",
      "entrypoint": "runPrompt",
      "qualification_enabled": false,
      "composition_root": null,
      "status": "qualification-disabled",
      "reason": "Product execution records G0-D diagnostics and is not a qualification runner."
    },
    {
      "entry_id": "production/vscode-chat",
      "classification": "production",
      "role": "product-surface",
      "source_ref": "packages/vscode-extension/src/extension.ts",
      "entrypoint": "runChat",
      "qualification_enabled": false,
      "composition_root": null,
      "status": "qualification-disabled",
      "reason": "Product execution records G0-D diagnostics and is not a qualification runner."
    },
    {
      "entry_id": "production/bridge-chat",
      "classification": "production",
      "role": "provider-transport",
      "source_ref": "packages/bridge/src/server.ts",
      "entrypoint": "POST /chat",
      "qualification_enabled": false,
      "composition_root": null,
      "status": "qualification-disabled",
      "reason": "Provider transport is callable only as a guarded adapter in future qualification runs."
    },
    {
      "entry_id": "production/bridge-preattach",
      "classification": "production",
      "role": "provider-transport",
      "source_ref": "packages/bridge/src/server.ts",
      "entrypoint": "POST /preattach",
      "qualification_enabled": false,
      "composition_root": null,
      "status": "qualification-disabled",
      "reason": "Provider transport is callable only as a guarded adapter in future qualification runs."
    },
    {
      "entry_id": "historical/phase-real-deepseek",
      "classification": "historical-disabled",
      "role": "development-harness",
      "source_ref": "scripts/devseek-phase0-12-verify.mjs",
      "entrypoint": "--real-deepseek",
      "qualification_enabled": false,
      "composition_root": null,
      "status": "qualification-disabled",
      "reason": "Legacy development observation has qualificationAuthority=none."
    },
    {
      "entry_id": "historical/agent-loop-real-deepseek",
      "classification": "historical-disabled",
      "role": "development-harness",
      "source_ref": "scripts/devseek-agent-loop-eval.mjs",
      "entrypoint": "--real-deepseek",
      "qualification_enabled": false,
      "composition_root": null,
      "status": "qualification-disabled",
      "reason": "Optional live smoke is historical development evidence, never qualification evidence."
    },
    {
      "entry_id": "historical/real-deepseek-web",
      "classification": "historical-disabled",
      "role": "development-harness",
      "source_ref": "scripts/devseek-real-deepseek-web-eval.mjs",
      "entrypoint": "main",
      "qualification_enabled": false,
      "composition_root": null,
      "status": "qualification-disabled",
      "reason": "Natural UI/live harness remains disabled for qualification until external authority exists."
    },
    {
      "entry_id": "historical/vscode-real-plugin-harness",
      "classification": "historical-disabled",
      "role": "development-harness",
      "source_ref": "packages/vscode-extension/src/ui/real-plugin-harness.ts",
      "entrypoint": "registerRealPluginDeepSeekHarnessCommand",
      "qualification_enabled": false,
      "composition_root": null,
      "status": "qualification-disabled",
      "reason": "Real-plugin reports remain legacy development observations with no qualification authority."
    }
  ]
}
